<?xml version="1.0"?>

<!DOCTYPE Normalisation SYSTEM "normalisation.dtd">

<Normalisation>
	<RelationSchema name="PROF-STUD">
		<Column>PROF-NR</Column>
		<Column>STUD-NR</Column>
		<Column>VORLESUNG</Column>
		<Column>SCRIPT</Column>
		<Column>ABSCHLUSS</Column>
	</RelationSchema>
	<FunctionalDependency>
		<FunctionallyDependentOn>PROF-NR</FunctionallyDependentOn>
		<FunctionallyDependentOn>STUD-NR</FunctionallyDependentOn>
		<FunctionallyAffected>VORLESUNG</FunctionallyAffected>
	</FunctionalDependency>
	<FunctionalDependency>
		<FunctionallyDependentOn>VORLESUNG</FunctionallyDependentOn>
		<FunctionallyAffected>SCRIPT</FunctionallyAffected>
	</FunctionalDependency>
	<FunctionalDependency>
		<FunctionallyDependentOn>STUD-NR</FunctionallyDependentOn>
		<FunctionallyAffected>ABSCHLUSS</FunctionallyAffected>
	</FunctionalDependency>
</Normalisation>
